<?xml version="1.0"?>

<!DOCTYPE UWSimScene SYSTEM "UWSimScene.dtd" >

<UWSimScene>
  <oceanState>
    <windx> 0.04 </windx>
    <windy> 0.04 </windy>
    <windSpeed> 12 </windSpeed>
    <depth> 1000 </depth>
    <reflectionDamping> 0.35 </reflectionDamping>
    <waveScale> 1e-7 </waveScale>
    <isNotChoppy> 0 </isNotChoppy>
    <choppyFactor> 2.5 </choppyFactor>
    <crestFoamHeight> 2.2 </crestFoamHeight>
    <oceanSurfaceHeight> 0 </oceanSurfaceHeight>
    <fog>
      <density> 0.1 </density>
      <color>
	<r>0</r>
	<g>0.05</g>
	<b>0.3</b>
      </color>
    </fog>
  </oceanState>
  <simParams>
    <disableShaders> 0 </disableShaders>
    <resw> 640 </resw>
    <resh> 480 </resh>
  </simParams>

  <camera>
    <freeMotion> 0 </freeMotion>
    <objectToTrack>giron500/base_link</objectToTrack>
    <fov> 60 </fov>
    <aspectRatio> 1.33 </aspectRatio>
    <near> 1 </near>
    <far> 10000 </far>
    <position>
      <!-- visio lateral esquerra-->
      <x>1.0</x>
      <y>-2.5</y>
      <z>-4</z> 
      <!-- visio des de sota-->
      <!-- <x>1.0</x>
      <y>0</y>
      <z>-6</z> -->
    </position> 
    <lookAt>
      <x>1.0</x>
      <y>0 </y>
      <z>-4.5 </z>
    </lookAt>
  </camera>

  <vehicle>
    <name>girona500</name>
    <file>data/scenes/g500ARMPandora.urdf</file>
    <jointValues>
      <joint> -0.75 </joint> <!--Brac -->
      <joint> 0.75 </joint> <!-- Ma -->
      <joint> 0.0 </joint> <!-- Support -->
      <joint> 0.0 </joint> <!-- Mou la pinsa avall jaw1 -->
      <joint> 0.0 </joint> <!-- No Fa res -->
      <joint> 0.0 </joint> <!-- No fa res -->
      <joint> 0.0 </joint> <!-- No fa res -->
     <!-- <joint> 1.57 </joint>
      <joint> 0 </joint>
      <joint> 0 </joint> -->
    </jointValues>
    <position>
      <x> 0</x>
      <y> 0 </y>
      <z> -3.5 </z>
    </position>
    <orientation>
      <r>3.1415 </r>
      <p>0 </p>
      <y>0 </y>
    </orientation>
  <virtualCamera>
    <name>bowtech</name>
    <relativeTo>base_link</relativeTo>
    <resw> 160 </resw>
    <resh> 120 </resh>
    <position>
      <x>-0.5</x>
      <y> 1 </y>
      <z> -0.2 </z>
    </position>  
  </virtualCamera>
  </vehicle>

  <rosInterfaces>
    <ROSOdomToPAT>
      <topic> /dataNavigator </topic>
      <vehicleName> girona500 </vehicleName>
    </ROSOdomToPAT>
    <PATToROSOdom>
      <topic> /uwsim/girona500_odom </topic>
      <vehicleName> girona500 </vehicleName>
    </PATToROSOdom>
    <ArmToROSJointState> 
	<topic>/uwsim/joint_state</topic>
	<vehicleName> girona500 </vehicleName>
    </ArmToROSJointState>
    <ROSJointStateToArm> 
	<topic>/uwsim/joint_state_command</topic>
	<vehicleName> girona500 </vehicleName>
    </ROSJointStateToArm>
    <VirtualCameraToROSImage> 
      <cameraName>bowtech1</cameraName>
      <imageTopic> /uwsim/camera1 </imageTopic>
      <infoTopic> /uwsim/camera1_info </infoTopic>
    </VirtualCameraToROSImage>
    <RangeSensorToROSRange>
      <name>sonar</name>
      <topic> /uwsim/g500/range </topic>
      <rate>10</rate>
    </RangeSensorToROSRange>	
  </rosInterfaces> 

</UWSimScene>

